42,0W34,8.91E+12,0W34_30,Size,0W34,61034100,Greenfibre,Greenfibre Mens Dark Grey Terry Rayon Slim Fit Solid Formal Trouser,"Elevate your formal attire with the Greenfibre Mens Dark Grey Terry Rayon Slim Fit Solid Formal Trouser. Crafted from high-quality Terry Rayon fabric, these trousers combine a formal look with exceptional comfort. The slim fit design enhances your silhouette, while the solid pattern adds a touch of sophistication. These trousers feature a flat front with a single waist button for closure and belt loops. With ankle-length styling, they offer an appealing look thats perfect for various occasions. The trousers are equipped with four pockets – two at the back (one with a button) and two at the front. Pair them with a light-colored shirt and classic oxfords to complete your formal ensemble. Ideal for both formal and semi-formal occasions, these trousers are a versatile addition to your wardrobe",Crafted from Terry Rayon fabric for a perfect blend of formality and comfort.,Flat front design with a single waist button and belt loops for closure.,Ankle-length cut adds a stylish touch.,Equipped with four pockets – two at the back (one with button) and two at the front.,Pair with a light-colored shirt and classic oxfords for a refined formal look.,"Greenfibre,Dark Grey,Terry Rayon,Solid,Mid Rise,Formal,Slim Fit,Buttoned,latest design,ankle length,denim trouser,pant,pantaloons,britches,bell-bottoms,for gents,boys",https://www.dl.dropboxusercontent.com/scl/fi/51v44qswy8nis0gepwdv0/0W34_1.JPG?rlkey=s97792oxhv6mv8opl5g00o79a&dl=0
43,0W35,8.91E+12,0W35_30,Size,0W35,61034100,Greenfibre,Greenfibre Mens Wine Terry Rayon Slim Fit Solid Formal Trouser,"Upgrade your formal wardrobe with the Greenfibre Mens Wine Terry Rayon Slim Fit Solid Formal Trouser. Crafted with care, these trousers combine style and comfort seamlessly. The slim fit design exudes modern sophistication, while the Terry Rayon fabric ensures a polished look and comfortable wear throughout the day. The solid pattern adds a touch of elegance to your ensemble, making these trousers perfect for formal occasions.",Crafted from high-quality Terry Rayon fabric for a refined appearance and comfortable feel.,Slim fit design that offers a contemporary and sleek silhouette.,Solid pattern adds a touch of sophistication to your formal look.,Thoughtfully designed with attention to detail for a comfortable fit.,Versatile wine color that pairs effortlessly with a range of shirts and shoes.,"Greenfibre,Wine,Terry Rayon,Solid,Mid Rise,Formal,Slim Fit,Buttoned,latest design,ankle length,denim trouser,pant,pantaloons,britches,bell-bottoms,for gents,boys",https://www.dl.dropboxusercontent.com/scl/fi/4w7s4uen8j8h7gawm1kkm/0W35_1.JPG?rlkey=ki397ua0lcmmc52xjz2vx937m&dl=0
44,0XT2,8.91E+12,0XT2_30,Size,0XT2,61034100,Greenfibre,Greenfibre Mens Black Terry Rayon Super Slim Fit Solid Formal Trouser,"Elevate your formal attire with the Greenfibre Mens Black Terry Rayon Super Slim Fit Solid Formal Trouser. Crafted with meticulous attention to detail, this trouser offers both style and comfort. The super slim fit silhouette exudes modern sophistication, while the high-quality Terry Rayon fabric ensures a polished appearance and a comfortable feel all day long. The solid black pattern adds a touch of timeless elegance to your ensemble.","Designed in a super slim fit, creating a contemporary and tailored look.",Crafted from premium Terry Rayon fabric for a refined texture and exceptional comfort.,Versatile solid black pattern that pairs effortlessly with various shirts and blazers.,"Thoughtfully designed with a focus on both style and comfort, making it ideal for extended wear.","Perfectly suited for formal occasions, presentations, and events where impeccable attire is a must.","Greenfibre,Black,Terry Rayon,Solid,Mid Rise,Formal,Super Slim Fit,Buttoned,latest design,ankle length,denim trouser,pant,pantaloons,britches,bell-bottoms,for gents,boys",https://www.dl.dropboxusercontent.com/scl/fi/ioz88eimeuo4li2igvbr2/0XT2_1.JPG?rlkey=81jk91sl7iqiwec9lr2dfoo9h&dl=0
45,OOEM,8.91E+12,OOEM_38,Size,OOEM,61033100,Modi Jacket,Modi Jacket Mens Black Terry Wool Textured Regular Fit Jacket,"Elevate your traditional look with the JadeBlue Black Terry Wool Textured Modi Jacket. Crafted with care, this jacket combines classic style with modern comfort. The regular fit ensures a comfortable wearing experience, while the textured pattern adds a touch of sophistication. Made from premium terry wool fabric, this Modi jacket is perfect for enhancing your festive and formal ensembles. Whether youre attending a wedding or a special occasion, this jacket effortlessly complements your style.",Crafted from high-quality Terry Wool fabric for ultimate comfort and warmth.,Distinct textured pattern adds a touch of elegance and sophistication.,Regular fit design offers a comfortable and stylish silhouette.,Versatile black color makes it a versatile addition to your wardrobe,"Ideal choice for traditional events, weddings, and formal gatherings.","Modi Jacket,Black,Terry Wool,Textured,sleeveless,Ethnic party casual wear,Regular Fit,Mandarin,pocket,new season,latest design,stylish,buttoned,jacket,bandhgala,nehru jacket,top,for man,gents,boys",https://www.dl.dropboxusercontent.com/scl/fi/chd5a11avccnfqf8a8gju/OOEM_1.JPG?rlkey=b7u5ml06l90zcwarld7qrp5gr&dl=0
46,OOEO,8.91E+12,OOEO_38,Size,OOEO,61033100,Modi Jacket,Modi Jacket Mens Orange Terry Wool Textured Regular Fit Jacket,"Elevate your style with the JadeBlue Orange Terry Wool Textured Modi Jacket. Crafted by JadeBlue, this Modi Jacket boasts a regular fit that combines comfort and style effortlessly. Made from high-quality terry wool fabric, it offers a unique textured pattern that sets it apart. Whether its a festive occasion or a formal event, this jacket complements your look flawlessly. The rich orange hue adds a pop of color to your ensemble. Step up your fashion game with this versatile and eye-catching Modi Jacket from JadeBlue.",Impeccable comfort and style with the regular fit design.,Crafted from premium terry wool fabric for warmth and durability.,A vibrant orange hue that adds a touch of vibrancy to your outfit.,"Suitable for various occasions, from festive celebrations to formal gatherings.",Stand out with the distinctive textured pattern.,"Modi Jacket,Orange,Terry Wool,Textured,sleeveless,Ethnic party casual wear,Regular Fit,Mandarin,pocket,new season,latest design,stylish,buttoned,jacket,bandhgala,nehru jacket,top,for man,gents,boys",https://www.dl.dropboxusercontent.com/scl/fi/0qndty6p4ozxqe1hjjcx6/OOEO_1.JPG?rlkey=yb8jkf7ruvzi6n68d3rv0p820&dl=0
47,JGRD,8.91E+12,JGRD_38,Size,JGRD,61121910,Greenfibre,Greenfibre Mens Olive Camo 100% Cotton Slim Fit Printed Track Pant,"Discover comfort and style with the Greenfibre Mens Olive Camo Slim Fit Printed Track Pant. Crafted with care from 100% Cotton fabric, these track pants offer a perfect blend of comfort and durability. The slim fit design ensures a sleek look that complements your active lifestyle. The eye-catching printed pattern adds a touch of uniqueness to your outfit. Whether youre hitting the gym or lounging at home, these track pants provide the perfect balance of fashion and functionality. Elevate your casual wardrobe with these Olive Camo track pants from Greenfibre.",Slim fit design offers a contemporary and stylish appearance.,Made with 100% Cotton fabric for exceptional comfort and breathability.,Unique printed pattern adds a fashionable twist to your attire.,"Perfect for workouts, outdoor activities, and casual lounging.",Elevate your casual style with the Olive Camo track pants from Greenfibre.,"Greenfibre,Olive Camo,100% Cotton,Printed,Mid Rise,Casual,Slim Fit,Elastic,Drawstring,latest design,ankle length,denim,track pant,jogger for gents,boys",https://www.dl.dropboxusercontent.com/scl/fi/yd5zz5l6v06sz2bi5l3vf/JGRD_1.JPG?rlkey=arn7zftt2kqqlhtrezkor4vd5&dl=0
48,OOGD,8.91E+12,OOGD_39,Size,OOGD,61072100,JadeBlue,JadeBlue Mens Fawn 100% Cotton Slim Fit Solid Track Pant,"Upgrade your casual wear with the JadeBlue Mens Fawn Slim Fit Solid Track Pant. Crafted from 100% Cotton fabric, these track pants offer a comfortable and breathable experience, perfect for daily activities. The slim fit design adds a modern touch to your look, while the solid pattern keeps your style versatile. Whether youre lounging at home or stepping out for a quick errand, these track pants are a stylish choice. Elevate your wardrobe with comfort and sophistication.",Made with 100% Cotton fabric for exceptional comfort and breathability.,Slim fit design provides a modern and tailored look.,Solid pattern offers versatility for various outfit combinations.,Elastic waistband and drawstring for a secure and adjustable fit.,"Ideal for casual outings, lounging, and everyday wear.","JadeBlue,Fawn,100% Cotton,Solid,Mid Rise,Casual,Slim Fit,Elastic,Drawstring,latest design,ankle length,denim,track pant,jogger for gents,boys",https://www.dl.dropboxusercontent.com/scl/fi/nb2pw6o9folqhxzrafek9/OOGD_1.JPG?rlkey=dyscysfruiqr048k458z06dzg&dl=0
49,OOGE,8.91E+12,OOGE_39,Size,OOGE,61072100,JadeBlue,JadeBlue Mens Olive Green 100% Cotton Slim Fit Solid Track Pant,"Upgrade your casual wardrobe with the JadeBlue Olive Green Track Pant. Crafted from 100% Cotton fabric, these track pants offer both comfort and style. Designed in a slim fit, they provide a modern and sleek look for your everyday attire. The solid pattern adds a touch of versatility to your outfit, making them suitable for various occasions. Whether youre lounging at home or heading out, these track pants are your perfect companion. Elevate your casual fashion game with JadeBlue.",Crafted from 100% Cotton fabric for exceptional comfort.,Slim fit design offers a modern and stylish silhouette.,Solid pattern adds versatility to your wardrobe.,Elastic waistband with drawstring for a secure and adjustable fit.,Perfect for both lounging and casual outings.,"JadeBlue,Olive Green,100% Cotton,Solid,Mid Rise,Casual,Slim Fit,Elastic,Drawstring,latest design,ankle length,denim,track pant,jogger for gents,boys",https://www.dl.dropboxusercontent.com/scl/fi/9vpdge97k88pph1e7e1lw/OOGE_1.JPG?rlkey=nvmuiwrcorhsr6l98ijng2qfx&dl=0
50,OOGH,8.91E+12,OOGH_39,Size,OOGH,61072100,JadeBlue,JadeBlue Mens Wine 100% Cotton Slim Fit Solid Track Pant,"Enhance your comfort and style with these JadeBlue Mens Slim Fit Solid Track Pants. Crafted from 100% Cotton fabric, these track pants offer a luxurious feel and excellent breathability. The slim fit design provides a modern and sleek look, perfect for both casual outings and lounging at home. The solid pattern adds a touch of sophistication to your attire. Whether youre hitting the gym or running errands, these track pants ensure a comfortable and fashionable experience. Elevate your wardrobe with the timeless appeal of JadeBlues Wine Track Pants.","Made from 100% Cotton fabric, ensuring superior comfort and breathability.",Slim fit design offers a contemporary and stylish appearance.,Solid pattern adds an element of sophistication to your ensemble.,Ideal for both casual wear and leisure activities.,Experience comfort and fashion in one with JadeBlues Wine Track Pant.,"JadeBlue,Wine,100% Cotton,Solid,Mid Rise,Casual,Slim Fit,Elastic,Drawstring,latest design,ankle length,denim,track pant,jogger for gents,boys",https://www.dl.dropboxusercontent.com/scl/fi/ib5l2wfzv8k9s9pgyqgf9/OOGH_1.JPG?rlkey=o3woh0bjljb2syg5oa85xw410&dl=0
