Serial No.,Parent SKU,EAN,Variation SKU,Variation Type,Group ID,HSN,Brand,Product Name,Description,Key Feature 1,Key Feature 2,Key Feature 3,Key Feature 4,Key Feature 5,Search Key Words (AZ),Main Image Link
1,0C3M,8.91E+12,0C3M_38,Size,0C3M,61051010,Greenfibre,Greenfibre Mens Rust 100% Cotton Slim Fit Solid Casual Shirt,"Elevate your casual wardrobe with this Rust Solid Casual Shirt from Greenfibre. Crafted with the utmost attention to detail, this shirt boasts a slim fit thats both comfortable and stylish. Made from 100% Cotton fabric, it guarantees breathability and all-day comfort. The half sleeves and classic collar add a touch of sophistication, making it perfect for various occasions. Whether youre heading out for a casual hangout or a relaxed office day, this shirt effortlessly combines comfort and style.",Crafted from 100% Cotton fabric for exceptional comfort and breathability.,Slim fit design ensures a modern and stylish look.,Solid pattern adds versatility to your wardrobe.,Half sleeves offer a laid-back yet refined appearance.,Classic collar completes the smart-casual vibe.,"Greenfibre,Rust,100% Cotton,Solid,Half Sleeve,Casual,Slim Fit,Cut Away,pocket,new season,latest design,stylish,pullover,shirt top,for man,gents,boys",https://www.dl.dropboxusercontent.com/scl/fi/yn3frc2dwfcf252nqjllf/0C3M_1.JPG?rlkey=e3w2b65cyq41ag91r6slweq4s&dl=0
2,2RWI,8.91E+12,2RWI_38,Size,2RWI,61051010,Greenfibre,Greenfibre Mens Off White 100% Cotton Slim Fit Printed Casual Shirt,"Upgrade your casual wardrobe with the Greenfibre Mens Off White Slim Fit Printed Casual Shirt. Crafted by Greenfibre, this shirt offers a comfortable and stylish option for your everyday look. Made from 100% Cotton fabric, it ensures breathability and all-day comfort. The slim fit design adds a touch of modernity to your attire, while the full sleeves provide versatility for any weather. The off white color complements a variety of outfits, making it a versatile addition to your collection. Whether youre heading to a casual gathering or a day out, this shirt is a perfect choice. Elevate your style effortlessly with the Greenfibre Off White Casual Shirt.","Crafted from 100% Cotton fabric, ensuring breathability and comfort all day long.",Stylish printed pattern that adds a contemporary touch to your outfit.,Slim fit design that offers a modern and tailored appearance.,"Full sleeves for versatile styling, suitable for various weather conditions.",Off white color that effortlessly pairs with different bottoms and accessories.,"Greenfibre,Off White,100% Cotton,Printed,Full Sleeve,Casual,Slim Fit,Cut Away,pocket,new season,latest design,stylish,pullover,shirt top,for man,gents,boys",https://www.dl.dropboxusercontent.com/scl/fi/8qzisezy3eljlxt0b8bqt/2RWI_1.JPG?rlkey=jqe6wpmunvpoxu9z5zi1pf0zk&dl=0
3,3RWI,8.91E+12,3RWI_38,Size,3RWI,61051010,Greenfibre,Greenfibre Mens Slim Fit Printed Casual Shirt - Duffel Green 100% Cotton,"Elevate your casual wardrobe with the Greenfibre Mens Slim Fit Printed Casual Shirt in the captivating shade of Duffel Green. Crafted from 100% Cotton fabric, this shirt ensures comfort that lasts all day. The slim fit design offers a sleek and contemporary look, perfect for various occasions. The full sleeves add a touch of sophistication, making it versatile for both casual outings and semi-formal gatherings. With its eye-catching printed pattern, this shirt effortlessly adds a dash of style to your ensemble. Whether you pair it with jeans for a laid-back vibe or dress it up with chinos, the Greenfibre Casual Shirt is your go-to choice for a fashion-forward statement.",Crafted from high-quality 100% Cotton fabric for enduring comfort.,Slim fit design for a modern and stylish silhouette.,Full sleeves offer versatility for different occasions.,Captivating Duffel Green color complements a range of outfits.,Perfect for casual outings or dressing up for semi-formal events.,"Greenfibre,Duffel Green,100% Cotton,Printed,Full Sleeve,Casual,Slim Fit,Cut Away,pocket,new season,latest design,stylish,pullover,shirt top,for man,gents,boys",https://www.dl.dropboxusercontent.com/scl/fi/g1yutiyoh36hkx9g652li/3RWI_1.JPG?rlkey=3rg12t8jogwy2182d1u19bdjc&dl=0
4,3UXY,8.91E+12,3UXY_38,Size,3UXY,61051010,Greenfibre,Greenfibre Mens Blue 100% Cotton Slim Fit Solid Casual Shirt,"Elevate your casual wardrobe with the Greenfibre Mens Blue 100% Cotton Slim Fit Solid Casual Shirt. Crafted from premium 100% cotton fabric, this shirt promises both comfort and style. The slim fit design contours to your body for a modern and sleek look, while the solid pattern adds a touch of sophistication. With full sleeves and a versatile blue hue, this shirt effortlessly transitions from day to night.","Crafted from premium 100% cotton fabric, ensuring superior comfort throughout the day.",Slim fit design that offers a contemporary and well-defined silhouette.,Solid pattern adds a touch of understated elegance to your outfit.,Full sleeves provide versatile styling options and keep you covered in varying temperatures.,"Ideal for casual occasions, easily pair it with your favorite jeans or chinos for a polished yet relaxed look.","Greenfibre,Blue,100% Cotton,Solid,Full Sleeve,Casual,Slim Fit,Cut Away,pocket,new season,latest design,stylish,pullover,shirt top,for man,gents,boys",https://www.dl.dropboxusercontent.com/scl/fi/iid11efpkogpl22b3g7ix/3UXY_1.JPG?rlkey=icenc3y0n1vt5svzgt3zaqssm&dl=0
5,4TWI,8.91E+12,4TWI_38,Size,4TWI,61051010,Greenfibre,Greenfibre Mens Vineyard Green 100% Cotton Slim Fit Printed Casual Shirt,"Elevate your casual wardrobe with this Mens Vineyard Green Printed Casual Shirt by Greenfibre. Crafted from 100% Cotton fabric, this slim fit shirt promises both comfort and style. The vibrant printed pattern adds a touch of uniqueness to your ensemble. With full sleeves, this shirt is versatile for any season. Whether youre headed to a weekend brunch or a casual hangout, this shirt is a perfect choice. Express your individuality with Greenfibres exquisite design and exceptional comfort.",Made from 100% Cotton fabric for ultimate comfort.,Slim fit design enhances your silhouette.,Eye-catching printed pattern adds a trendy touch.,Full sleeves offer versatility for various occasions.,Vibrant Vineyard Green color stands out in style.,"Greenfibre,Vineyard Green,100% Cotton,Printed,Full Sleeve,Casual,Slim Fit,Cut Away,pocket,new season,latest design,stylish,pullover,shirt top,for man,gents,boys",https://www.dl.dropboxusercontent.com/scl/fi/ts62d0jzc5krnx633j6yv/4TWI_1.JPG?rlkey=0eqbqgk6rxw46qs48slzgtt73&dl=0
6,4UXY,8.91E+12,4UXY_38,Size,4UXY,61051010,Greenfibre,Greenfibre Mens Quite Green 100% Cotton Slim Fit Solid Casual Shirt,"Elevate your casual wardrobe with the Greenfibre Mens Quite Green Slim Fit Solid Casual Shirt. Crafted from 100% Cotton fabric, this shirt offers both comfort and style. The slim fit design enhances your silhouette, while the solid pattern adds a touch of versatility. Whether youre heading out for a casual gathering or a relaxed day at the office, this shirt is a perfect choice. It features full sleeves for a classic look. Pair it with your favorite jeans or chinos for a complete ensemble that exudes confidence.",Crafted from 100% Cotton fabric for all-day comfort.,Slim fit design provides a modern and flattering silhouette.,Solid pattern adds a versatile touch to your wardrobe.,Full sleeves offer a classic and timeless look.,Available in the refreshing Quite Green color.,"Greenfibre,Quite Green,100% Cotton,Solid,Full Sleeve,Casual,Slim Fit,Cut Away,pocket,new season,latest design,stylish,pullover,shirt top,for man,gents,boys",https://www.dl.dropboxusercontent.com/scl/fi/6g8gapviofczl5p208yrd/4UXY_1.JPG?rlkey=3j248f8l3qv4aff9rhg6dw4r9&dl=0
7,5TWI,8.91E+12,5TWI_38,Size,5TWI,61051010,Greenfibre,Greenfibre Mens Deep Water Blue 100% Cotton Slim Fit Printed Casual Shirt,"Elevate your casual wardrobe with this Deep Water Blue Slim Fit Printed Casual Shirt from Greenfibre. Crafted with care from 100% Cotton fabric, this shirt ensures a comfortable and breathable experience throughout the day. The slim fit design adds a touch of sleekness, making it a versatile addition to your collection. The printed pattern adds a stylish flair that sets you apart. Embrace the full sleeves for a classic look that transitions effortlessly from day to night. Whether youre heading to a casual outing or a laid-back gathering, this shirt pairs perfectly with your favorite jeans or chinos. Upgrade your style effortlessly with Greenfibre.",Crafted from 100% Cotton fabric for exceptional comfort and breathability.,Stylish printed pattern that adds a unique and fashionable touch.,Slim fit design for a modern and streamlined appearance.,Full sleeves provide a timeless look suitable for various occasions.,Deep Water Blue shade that complements your individual style.,"Greenfibre,Deep Water Blue,100% Cotton,Printed,Full Sleeve,Casual,Slim Fit,Cut Away,pocket,new season,latest design,stylish,pullover,shirt top,for man,gents,boys",https://www.dl.dropboxusercontent.com/scl/fi/pq20w12t5q9gae6qgbu8x/5TWI_1.JPG?rlkey=3qmh8z4owi497s7hcdfreijwb&dl=0
8,BX2Z,8.91E+12,BX2Z_38,Size,BX2Z,61051010,Greenfibre,Greenfibre Mens Red Checked 100% Cotton Slim Fit Casual Shirt,"Elevate your casual wardrobe with this Red Checked Casual Shirt from Greenfibre. Crafted with 100% Cotton fabric, this slim fit shirt offers both comfort and style. The classic checked pattern adds a touch of versatility to your ensemble. Designed with full sleeves and a button-down front, this shirt is perfect for various occasions. Pair it with your favorite jeans or chinos for a smart and laid-back look thats sure to make a statement.",Crafted with 100% Cotton fabric for ultimate comfort.,Slim fit design enhances your style quotient.,Classic checked pattern adds a touch of versatility.,Full sleeves offer a sophisticated appearance.,Button-down front for a polished and casual look.,"Greenfibre,Red,100% Cotton,Checked,Full Sleeve,Casual,Slim Fit,Cut Away,pocket,new season,latest design,stylish,pullover,shirt top,for man,gents,boys",https://www.dl.dropboxusercontent.com/scl/fi/xx4mpi0dwtrxrjtf3y3nc/BX2Z_1.JPG?rlkey=69s35qgbafedaperdok6xtwp3&dl=0
9,BX5Y,8.91E+12,BX5Y_38,Size,BX5Y,61051010,JadeBlue,JadeBlue Mens Light Navy Blue 100% Cotton Slim Fit Printed Casual Shirt,"Elevate your casual style with this Light Navy Blue Printed Casual Shirt by JadeBlue. Crafted from 100% Cotton fabric, this slim fit shirt promises both comfort and style. The intricate print pattern adds a touch of uniqueness, while the full sleeves provide versatility for various occasions. Whether youre heading out for a relaxed day or a casual evening, this shirt is the perfect choice. Pair it with your favorite jeans or chinos to complete the look effortlessly.",Crafted from 100% Cotton fabric for maximum comfort.,Slim fit design offers a modern and stylish silhouette.,Intricate printed pattern adds a unique touch to your outfit.,Full sleeves provide versatility for different weather conditions.,Versatile and ideal for both relaxed days and casual outings.,"JadeBlue,Light Navy Blue,100% Cotton,Printed,Full Sleeve,Casual,Slim Fit,Cut Away,pocket,new season,latest design,stylish,pullover,shirt top,for man,gents,boys",https://www.dl.dropboxusercontent.com/scl/fi/pkdt24y44xejgkcovum2k/BX5Y_1.JPG?rlkey=r00j5m1jel35qzkqkk3c89mec&dl=0
10,BY1Z,8.91E+12,BY1Z_38,Size,BY1Z,61051010,JadeBlue,JadeBlue Mens Sky Blue 100% Cotton Slim Fit Striped Casual Shirt,"Elevate your casual style with the JadeBlue Mens Sky Blue Striped Casual Shirt. Crafted from premium 100% Cotton fabric, this slim fit shirt offers both comfort and a stylish look. The classic striped pattern adds a touch of sophistication, making it suitable for various occasions. With full sleeves that exude versatility, this shirt is perfect for your everyday wardrobe. Whether youre going for a relaxed outing or a casual hangout, this shirt pairs effortlessly with your favorite jeans or chinos.",Made with high-quality 100% Cotton fabric for exceptional comfort.,Slim fit design that accentuates your physique while ensuring comfort.,Elegant striped pattern adds a timeless appeal to your outfit.,Full sleeves offer versatility for different weather conditions.,"Perfect choice for a casual yet stylish look, ideal for outings and gatherings.","JadeBlue,Sky Blue,100% Cotton,Striped,Full Sleeve,Casual,Slim Fit,Cut Away,pocket,new season,latest design,stylish,pullover,shirt top,for man,gents,boys",https://www.dl.dropboxusercontent.com/scl/fi/tihnaukpmafdqrbruv0sf/BY1Z_1.JPG?rlkey=5mbmtwf32pm20nnoz4ewuejsm&dl=0
11,BY4Z,8.91E+12,BY4Z_38,Size,BY4Z,61051010,JadeBlue,JadeBlue Mens Red Checked 100% Cotton Slim Fit Casual Shirt,"Elevate your casual wardrobe with the JadeBlue Mens Red Checked Slim Fit Casual Shirt. Crafted from premium 100% Cotton fabric, this shirt offers both comfort and style. The slim fit design complements your physique, while the vibrant red checked pattern adds a touch of flair. With full sleeves for versatility and a comfortable fit, this shirt is perfect for any occasion. Upgrade your fashion game with this must-have piece from JadeBlue.",Crafted from high-quality 100% Cotton fabric for superior comfort.,"Slim fit design enhances your silhouette, creating a modern and stylish look.",Eye-catching red checked pattern adds a dynamic element to your outfit.,Full sleeves provide versatility and keep you comfortable year-round.,"Ideal for casual gatherings or outings, making it a versatile addition to your wardrobe.","JadeBlue,Red,100% Cotton,Checked,Full Sleeve,Casual,Slim Fit,Cut Away,pocket,new season,latest design,stylish,pullover,shirt top,for man,gents,boys",https://www.dl.dropboxusercontent.com/scl/fi/uyr7mi3prmsuemlqpgra5/BY4Z_1.JPG?rlkey=wl3ay84bqqih4997kx4d6mhfw&dl=0
12,GL6Y,8.91E+12,GL6Y_38,Size,GL6Y,61051010,Greenfibre,Greenfibre Mens Aurora Red 100% Cotton Slim Fit Checked Casual Shirt,"Upgrade your casual wardrobe with the Greenfibre Mens Aurora Red Slim Fit Checked Casual Shirt. Crafted from 100% Cotton fabric, this shirt ensures a comfortable and breathable experience throughout the day. The slim fit design offers a sleek and modern look thats perfect for various occasions. With its eye-catching checked pattern in Aurora Red, this shirt adds a touch of style to your ensemble. The full sleeves provide extra coverage, making it suitable for any season. Whether youre going out for a casual gathering or a laid-back day, this shirt combines comfort and fashion effortlessly.",Made from 100% Cotton fabric for all-day comfort and breathability.,Slim fit design for a contemporary and stylish appearance.,Distinctive checked pattern in Aurora Red adds a pop of color to your outfit.,Full sleeves offer versatility for different weather conditions.,Elevate your casual look with the sophisticated appeal of Greenfibres slim fit casual shirt.,"Greenfibre,Aurora Red,100% Cotton,Checked,Full Sleeve,Casual,Slim Fit,Cut Away,pocket,new season,latest design,stylish,pullover,shirt top,for man,gents,boys",https://www.dl.dropboxusercontent.com/scl/fi/l8lq2epims2op298xceuh/GL6Y_1.JPG?rlkey=ze2uav699kz6uj4y2lr1g7g3g&dl=0
13,GL7Y,8.91E+12,GL7Y_38,Size,GL7Y,61051010,Greenfibre,Greenfibre Mens Vineyard Green 100% Cotton Slim Fit Checked Casual Shirt,"Upgrade your casual wardrobe with this stylish Vineyard Green Casual Shirt from Greenfibre. Crafted from 100% Cotton fabric, this slim fit shirt ensures both comfort and a trendy look. The checked pattern adds a touch of sophistication to your ensemble. Designed with full sleeves, this shirt is perfect for all-day wear. Whether youre heading out with friends or want to make a statement at a casual event, this shirt is the ideal choice. Pair it with your favorite jeans or chinos for a complete and fashionable outfit.",Made from 100% Cotton fabric for a comfortable and breathable experience.,Slim fit design enhances your silhouette and modernizes your look.,Full sleeves provide versatility for various occasions and weather.,"Ideal for outings, gatherings, or casual events.",Match it effortlessly with jeans or chinos to create a fashionable ensemble.,"Greenfibre,Vineyard Green,100% Cotton,Checked,Full Sleeve,Casual,Slim Fit,Cut Away,pocket,new season,latest design,stylish,pullover,shirt top,for man,gents,boys",https://www.dl.dropboxusercontent.com/scl/fi/2batkfumms50741or16gq/GL7Y_1.JPG?rlkey=o4d724i986flvitzt7504m28e&dl=0
14,HJJY,8.91E+12,HJJY_38,Size,HJJY,61051010,Greenfibre,Greenfibre Mens Yellow Cotton Blend Slim Fit Checked Formal Shirt,"Elevate your formal wear with this Yellow Checked Formal Shirt by Greenfibre. Crafted with a comfortable Cotton Blend fabric, this slim fit shirt promises both style and comfort. The checked pattern adds a touch of sophistication, while the full sleeves ensure a polished look. Perfect for various occasions, this shirt pairs well with tailored trousers and classic shoes, helping you achieve a refined appearance.",Crafted with a comfortable Cotton Blend fabric for all-day ease.,Slim fit design for a modern and tailored appearance.,Distinct checked pattern adds a touch of sophistication.,Full sleeves provide a polished and versatile look.,"Ideal for formal events, meetings, and special occasions.","Greenfibre,Yellow,Cotton Blend,Checked,Full Sleeve,Formal,Slim Fit,Cut Away,pocket,new season,latest design,stylish,pullover,shirt top,for man,gents,boys",https://www.dl.dropboxusercontent.com/scl/fi/mpom6icwabgzsvafmtrz9/HJJY_1.JPG?rlkey=hjf6h5mx6wos68gpbvmf7y2tf&dl=0
15,KN1Q,8.91E+12,KN1Q_38,Size,KN1Q,61051010,JadeBlue,JadeBlue Mens Slim Fit Checked Casual Shirt - Oxford Blue,"Elevate your casual wardrobe with the JadeBlue Slim Fit Checked Casual Shirt in Oxford Blue. Crafted from 100% Cotton fabric, this shirt offers a comfortable and breathable experience all day long. The classic checked pattern adds a touch of style to your ensemble. With a slim fit and full sleeves, this shirt ensures a sleek look thats perfect for various occasions. Whether youre headed to a brunch or a casual evening out, this shirt pairs well with your favorite jeans or chinos. Experience comfort and style combined in this versatile casual shirt.",Crafted from 100% Cotton fabric for all-day comfort and breathability.,Classic checked pattern that adds a stylish touch to your outfit.,Slim fit design for a modern and sleek appearance.,Full sleeves provide coverage and style versatility.,Available in the timeless shade of Oxford Blue.,"JadeBlue,Oxford Blue,100% Cotton,Checked,Full Sleeve,Casual,Slim Fit,Cut Away,pocket,new season,latest design,stylish,pullover,shirt top,for man,gents,boys",https://www.dl.dropboxusercontent.com/scl/fi/xi8zzsp6lh98lom0qfwpa/KN1Q_1.JPG?rlkey=kgqwpu17keq3tbvi3pzy3kytt&dl=0
16,KN2Q,8.91E+12,KN2Q_38,Size,KN2Q,61051010,JadeBlue,JadeBlue Mens Aqua Green 100% Cotton Slim Fit Checked Casual Shirt,"Elevate your casual wardrobe with this JadeBlue Aqua Green Checked Casual Shirt. Crafted from premium 100% Cotton fabric, it promises all-day comfort and breathability. The slim fit silhouette ensures a modern look, while the classic checked pattern adds a touch of style. With full sleeves and a vibrant color, this shirt is a versatile addition to your collection. Pair it with your favorite jeans or chinos for a relaxed yet stylish outfit.",Crafted from high-quality 100% Cotton fabric for lasting comfort.,Slim fit design offers a contemporary and flattering silhouette.,Eye-catching checked pattern adds a trendy touch to your look.,Full sleeves provide coverage and a smart appearance.,Versatile Aqua Green color complements various bottoms for effortless styling.,"JadeBlue,Aqua Green,100% Cotton,Checked,Full Sleeve,Casual,Slim Fit,Cut Away,pocket,new season,latest design,stylish,pullover,shirt top,for man,gents,boys",https://www.dl.dropboxusercontent.com/scl/fi/bis16ucs890r91vflqkdp/KN2Q_1.JPG?rlkey=lhbq9fg0i5d7f9qmjksolllwh&dl=0
17,KN8Q,8.91E+12,KN8Q_38,Size,KN8Q,61051010,JadeBlue,JadeBlue Mens Blue & Yellow Checked 100% Cotton Slim Fit Casual Shirt - Half Sleeve,"Elevate your casual wardrobe with this JadeBlue Mens Checked Slim Fit Casual Shirt. Crafted from 100% Cotton fabric, it guarantees a comfortable and breathable wearing experience even during the warmest days. The striking blue and yellow checkered pattern adds a touch of vibrancy to your look.",Made with 100% Cotton fabric for all-day comfort and breathability.,Slim fit design enhances your silhouette for a modern appearance.,"Half sleeves offer a casual and comfortable feel, ideal for warmer weather.","Versatile and easy to style; pairs well with jeans, chinos, or shorts for various occasions.",Eye-catching blue and yellow checkered pattern for a stylish look.,"JadeBlue,Blue & Yellow,100% Cotton,Checked,Half Sleeve,Casual,Slim Fit,Cut Away,pocket,new season,latest design,stylish,pullover,shirt top,for man,gents,boys",https://www.dl.dropboxusercontent.com/scl/fi/j9d5w32jjxayn9h5hefol/KN8Q_1.JPG?rlkey=ipof0lcha2n52ltjcmlkxu8y0&dl=0
18,KOOO,8.91E+12,KOOO_38,Size,KOOO,61051010,Greenfibre,Greenfibre Mens Slim Fit Printed Cotton Blend Formal Shirt - Green,"Elevate your formal wardrobe with the Greenfibre Mens Slim Fit Printed Cotton Blend Formal Shirt in refreshing green. Crafted with a comfortable and breathable cotton blend fabric, this shirt offers a sleek and modern slim fit. The printed pattern adds a touch of sophistication, making it suitable for various occasions. Its full sleeves provide a polished look, and the shirts design is perfect for both professional and semi-formal settings. Enhance your style effortlessly with this Greenfibre formal shirt.",Expertly crafted from a comfortable and breathable cotton blend fabric.,Modern slim fit design for a sleek and tailored appearance.,Stylish printed pattern that adds a touch of sophistication.,Full sleeves for a polished and refined look.,Versatile green color suitable for various occasions and ensembles.,"Greenfibre,Green,Cotton Blend,Printed,Full Sleeve,Formal,Slim Fit,Cut Away,pocket,new season,latest design,stylish,pullover,shirt top,for man,gents,boys",https://www.dl.dropboxusercontent.com/scl/fi/bin5jljj263nhgwojpql7/KOOO_1.JPG?rlkey=vt913v6xuvk3xescz9ckn0r1s&dl=0
19,KOOP,8.91E+12,KOOP_38,Size,KOOP,61051010,Greenfibre,Greenfibre Mens Light Purple Cotton Blend Slim Fit Printed Formal Shirt,"Elevate your formal attire with the Greenfibre Mens Light Purple Slim Fit Printed Formal Shirt. Crafted from a comfortable and breathable Cotton Blend fabric, this shirt ensures a sleek and polished look. The slim fit design offers a modern silhouette thats perfect for formal occasions. The shirt features an eye-catching printed pattern that adds a touch of sophistication. With full sleeves and a classic collar, its an ideal choice for versatile styling. Pair it with tailored trousers and polished shoes to create a well-put-together ensemble that exudes confidence and style.",Crafted from a comfortable and breathable Cotton Blend fabric.,Eye-catching printed pattern adds a touch of sophistication.,Full sleeves offer versatile styling options.,Classic collar enhances the formal appeal of the shirt.,Slim fit design for a modern and polished look.,"Greenfibre,Light Purple,Cotton Blend,Printed,Full Sleeve,Formal,Slim Fit,Cut Away,pocket,new season,latest design,stylish,pullover,shirt top,for man,gents,boys",https://www.dl.dropboxusercontent.com/scl/fi/uk55efpho9kyrt6gya5fx/KOOP_1.JPG?rlkey=jx6gydhpgnufd6frzksf6rt4o&dl=0
20,NKEE,8.91E+12,NKEE_38,Size,NKEE,61051010,Greenfibre,Greenfibre Mens Pista Green Cotton Blend Checked Slim Fit Formal Shirt,"Elevate your formal wear with the Greenfibre Mens Pista Green Slim Fit Checked Formal Shirt. Crafted from a comfortable and breathable Cotton Blend fabric, this shirt promises a stylish and comfortable wearing experience. The slim fit design offers a sleek silhouette, while the appealing checked pattern adds a touch of sophistication. With full sleeves and a classic button-down collar, this shirt is perfect for both business and semi-formal occasions. Pair it with tailored trousers and polished shoes to complete your confident and refined look.",Crafted from a comfortable and breathable Cotton Blend fabric for all-day comfort.,Stylish checked pattern adds a touch of sophistication to your ensemble.,Slim fit design ensures a sleek and contemporary silhouette.,Full sleeves and a classic button-down collar for a polished look.,Versatile Pista Green color pairs well with various trouser and shoe options.,"Greenfibre,Pista Green,Cotton Blend,Checked,Full Sleeve,Formal,Slim Fit,Cut Away,pocket,new season,latest design,stylish,pullover,shirt top,for man,gents,boys",https://www.dl.dropboxusercontent.com/scl/fi/q3t0qcbc814ikfylmx0xn/NKEE_1.JPG?rlkey=742k1lw7e5ev3omo1zvrx1vg3&dl=0
